{
  "status": "partially_feasible",
  "selected_classes": [
    {"course_id": "62001001", "class_id": "6200100120260101"},
    {"course_id": "62001002", "class_id": "6200100220260101"},
    {"course_id": "62002031", "class_id": "6200203120260101"},
    {"course_id": "62003007", "class_id": "6200300720260101"}
  ],
  "changes": [
    {
      "course_id": "62001002",
      "from_class": "6200100220260102",
      "to_class": "6200100220260101",
      "reason": "原教学班为星期五 7-8 节，命中用户避开的时段；改为星期三 3-4 节的同课教学班。"
    },
    {
      "course_id": "62003007",
      "from_class": "6200300720260102",
      "to_class": "6200300720260101",
      "reason": "原教学班为星期二 9-10 节，与当前课表中已记录的时间段连堂过密；改为星期二 7-8 节的同课教学班。"
    }
  ],
  "risks": [
    {
      "course_id": "62001002",
      "level": "high",
      "reason": "该教学班剩余容量仅 8 个，存在选课失败风险，建议准备同课备选教学班。"
    },
    {
      "course_id": "62003007",
      "level": "medium",
      "reason": "是否需要补修取决于教务对学分差额的人工判定，判定结果可能改变本方案。"
    },
    {
      "course_id": null,
      "level": "low",
      "reason": "本学期总学分 12，低于用户上限 15，尚有调整空间。"
    }
  ],
  "unresolved": [
    {
      "type": "manual_confirmation",
      "message": "62002031 概率论与数理统计的课程等价关系尚未人工确认，当前按「可能等价、暂不补修」处理。"
    },
    {
      "type": "manual_confirmation",
      "message": "62003007 复变函数与积分变换存在学分差额（原 3 学分 / 新 2 学分），需人工判定是否补修。"
    },
    {
      "type": "missing_data",
      "message": "本方案仅基于 Mock 教学班数据生成，尚未接入真实课程开设数据，实际可选教学班可能不同。"
    }
  ],
  "objective_summary": "演示用方案：在避开星期五下午、不跨校区的前提下，安排 4 门补修课程共 12 学分；具体演示数据，非真实求解结果。"
}
